{
  "unit" : "PERCENT",
  "scope" : {
    "id" : "chi",
    "type" : "CITY",
    "contractCityId" : "CHI"
  },
  "value" : 99.28364961668970717607138368731934,
  "domain" : "VOLTE",
  "window" : {
    "to" : "2026-09-10T09:05:00Z",
    "from" : "2026-09-10T09:00:00Z",
    "sourceResolutionSeconds" : 300
  },
  "quality" : {
    "state" : "INSUFFICIENT_EVIDENCE",
    "reason" : "SOURCE_QUALITY_UNAVAILABLE"
  },
  "coverage" : {
    "ratio" : 1,
    "expectedSlots" : 1,
    "receivedSlots" : 1
  },
  "metricId" : "volte.setup.success",
  "revision" : 0,
  "datasetId" : "trace-link-bounded-fixture-v1",
  "finalized" : true,
  "synthetic" : true,
  "nullReason" : null,
  "primitives" : {
    "numerator" : 7900,
    "denominator" : 7957
  },
  "provenance" : {
    "seed" : 42,
    "sourceFile" : "city_kpi_5m.csv",
    "manifestSha256" : "48017fa7ccf83883c4975b4a175c6d9f6a9dbb491da8b8faa49c724246e6f775",
    "sourceNaturalId" : "e2092e22273ae02408e1d56b123bab3b7dbcdb13b5af6102fa1791ad81d2af12",
    "sourceRowNumber" : 1,
    "sourceRowSha256" : "7fdcd4963c7c76d121a6fed0685a3f299ac82eef69f2457b881308cb6ceff63c",
    "catalogueVersion" : "trace-link-geography-v2",
    "generatorVersion" : "reference-1.0",
    "importPolicyVersion" : "trace-link-native-source-v1"
  },
  "aggregation" : "RATIO_OF_SUMS",
  "messageType" : "trace-link-primitive-projection-v1",
  "projectionId" : "bcea328d0c89878a6b8ecf627ab1f8a06f7a9fd18bb4f1aa9f615a3630f11e32",
  "policyVersion" : "trace-link-kpi-v1",
  "schemaVersion" : 1,
  "sourceQuality" : null,
  "sourceCoverage" : null,
  "sourceNamespace" : "trace-link-reference-v1",
  "topologyVersion" : "trace-link-links-v1"
}